{
  "$schema": "https://json-schema.org/draft/2020-12/schema",
  "$id": "castingcompass.water-quality-advisory/2.0.0",
  "title": "CastingCompass public water-quality advisory overlay",
  "type": "object",
  "required": [
    "schemaVersion", "policyVersion", "policySha256", "collectorSha256",
    "siteCatalogSha256", "generatedAt", "status", "meaning",
    "freshness", "scoreContribution", "sources", "sites"
  ],
  "properties": {
    "schemaVersion": { "const": "castingcompass.water-quality-advisory/2.0.0" },
    "policyVersion": { "type": "string", "minLength": 1, "maxLength": 200 },
    "policySha256": { "$ref": "#/$defs/sha256" },
    "collectorSha256": { "$ref": "#/$defs/sha256" },
    "siteCatalogSha256": { "$ref": "#/$defs/sha256" },
    "generatedAt": { "type": "string", "format": "date-time" },
    "status": { "enum": ["fresh", "partial", "unavailable"] },
    "meaning": { "type": "string", "minLength": 20, "maxLength": 300 },
    "freshness": {
      "type": "object",
      "required": ["maximumSampleAgeDays"],
      "properties": {
        "maximumSampleAgeDays": { "type": "integer", "minimum": 1, "maximum": 14 }
      },
      "additionalProperties": false
    },
    "scoreContribution": {
      "type": "object",
      "required": ["mode", "positiveContributionAllowed", "activeAgencyStatusSuppressesRecommendation"],
      "properties": {
        "mode": { "const": "excluded-pending-frozen-baseline-validation" },
        "positiveContributionAllowed": { "const": false },
        "activeAgencyStatusSuppressesRecommendation": { "const": true }
      },
      "additionalProperties": false
    },
    "sources": {
      "type": "object",
      "minProperties": 1,
      "propertyNames": { "pattern": "^[a-z0-9]+(?:-[a-z0-9]+)*$" },
      "additionalProperties": { "$ref": "#/$defs/source" }
    },
    "sites": {
      "type": "object",
      "minProperties": 1,
      "propertyNames": { "pattern": "^[a-z0-9]+(?:-[a-z0-9]+)*$" },
      "additionalProperties": { "$ref": "#/$defs/siteAssessment" }
    }
  },
  "additionalProperties": false,
  "$defs": {
    "sha256": { "type": "string", "pattern": "^[a-f0-9]{64}$" },
    "source": {
      "type": "object",
      "required": [
        "agency", "programUrl", "statusUrl", "machineUrl",
        "absenceBehavior", "errorCategory"
      ],
      "properties": {
        "agency": { "type": "string", "minLength": 3, "maxLength": 160 },
        "programUrl": { "type": "string", "format": "uri", "pattern": "^https://" },
        "statusUrl": { "type": "string", "format": "uri", "pattern": "^https://" },
        "machineUrl": { "type": "string", "format": "uri", "pattern": "^https://" },
        "absenceBehavior": {
          "enum": ["neutral-only-with-current-complete-samples", "unknown"]
        },
        "errorCategory": { "type": ["string", "null"], "maxLength": 80 }
      },
      "additionalProperties": false
    },
    "siteAssessment": {
      "type": "object",
      "required": [
        "status", "recommendationEffect", "officialLabel", "detail",
        "sourceId", "stationIds", "stationNames", "sampleDates",
        "actionStartDates", "actionEndDates", "checkedAt", "scoreDelta", "sourceUrl"
      ],
      "properties": {
        "status": {
          "enum": [
            "closure", "posted", "advisory", "rain-advisory",
            "no-active-posting", "stale", "unmonitored", "unknown",
            "source-unavailable", "not-covered"
          ]
        },
        "recommendationEffect": { "enum": ["suppress", "neutral", "unknown"] },
        "officialLabel": { "type": "string", "minLength": 3, "maxLength": 160 },
        "detail": { "type": "string", "minLength": 20, "maxLength": 300 },
        "sourceId": {
          "type": ["string", "null"],
          "pattern": "^[a-z0-9]+(?:-[a-z0-9]+)*$"
        },
        "stationIds": {
          "type": "array",
          "uniqueItems": true,
          "items": {
            "type": "string",
            "minLength": 1,
            "maxLength": 96,
            "pattern": "^[A-Za-z0-9_.# -]+$"
          }
        },
        "stationNames": {
          "type": "array",
          "uniqueItems": true,
          "items": { "type": "string", "minLength": 1, "maxLength": 160 }
        },
        "sampleDates": {
          "type": "array",
          "uniqueItems": true,
          "items": { "type": "string", "format": "date" }
        },
        "actionStartDates": {
          "type": "array",
          "uniqueItems": true,
          "items": { "type": "string", "format": "date" }
        },
        "actionEndDates": {
          "type": "array",
          "uniqueItems": true,
          "items": { "type": "string", "format": "date" }
        },
        "checkedAt": { "type": "string", "format": "date-time" },
        "scoreDelta": { "type": "null" },
        "sourceUrl": { "type": "string", "format": "uri", "pattern": "^https://" }
      },
      "allOf": [
        {
          "if": {
            "required": ["status"],
            "properties": {
              "status": {
                "enum": ["closure", "posted", "advisory", "rain-advisory"]
              }
            }
          },
          "then": {
            "properties": {
              "recommendationEffect": { "const": "suppress" }
            }
          }
        },
        {
          "if": {
            "required": ["status"],
            "properties": {
              "status": { "const": "no-active-posting" }
            }
          },
          "then": {
            "properties": {
              "recommendationEffect": { "const": "neutral" }
            }
          }
        },
        {
          "if": {
            "required": ["status"],
            "properties": {
              "status": {
                "enum": [
                  "stale", "unmonitored", "unknown", "source-unavailable", "not-covered"
                ]
              }
            }
          },
          "then": {
            "properties": {
              "recommendationEffect": { "const": "unknown" }
            }
          }
        }
      ],
      "additionalProperties": false
    }
  }
}
